{"details":{"expected_units":{"crp":"mg/L","lymphocytes":"10^9/L","neutrophils":"10^9/L"},"weights":{"crp_risk":0.6,"nlr_risk":0.4}},"features":{"crp_mg_L":1.0,"crp_risk":0.1,"nlr":1.5,"nlr_risk":0.125},"input_schema":"semiocore.biomed.labs_panel.v1","provenance":{"created_utc":"1970-01-01T00:00:00+00:00","input_hash":"35c0bb2092ecac3cbce176ca1a72d9a0926018d3b3265f7c56ce752990974a2b","tool_version":"1.3.3"},"qc":{"missing":[],"notes":[],"ok":true,"outliers":[]},"recipe":"inflammation_score_v1","schema":"semiocore.biomed.score.v1","score":0.11}
