{"details":{"expected_units":{"hr":"bpm","hrv_rmssd":"ms","sleep_minutes":"min","steps":"count"},"weights":{"activity_risk":0.25,"hr_risk":0.25,"hrv_risk":0.25,"sleep_risk":0.25}},"features":{"activity_risk":0.0,"hr_risk":0.111111111111,"hr_steps_coupling":0.671514465234,"hrv_risk":0.041666666667,"mean_hr_bpm":60.0,"mean_hrv_rmssd_ms":38.333333333333,"sleep_risk":0.0,"total_sleep_min":420.0,"total_steps":9100.0},"input_schema":"semiocore.biomed.wearable_timeseries.v1","provenance":{"created_utc":"1970-01-01T00:00:00+00:00","input_hash":"c07d61cc6121bb974a65d744700e3c0745ebe8bcfbdf95ccd3071b01a6aee569","tool_version":"1.3.3"},"qc":{"missing":[],"notes":[],"ok":true,"outliers":[]},"recipe":"circadian_score_v1","schema":"semiocore.biomed.score.v1","score":0.038194444444}
