{"details":{"expected_units":{"fasting_glucose":"mg/dL","hba1c":"%","hdl":"mg/dL","triglycerides":"mg/dL"},"weights":{"glucose_risk":0.4,"hba1c_risk":0.4,"tg_hdl_risk":0.2}},"features":{"fasting_glucose":90.0,"glucose_risk":0.142857142857,"hba1c":5.2,"hba1c_risk":0.08,"hdl":55.0,"tg_hdl_ratio":2.0,"tg_hdl_risk":0.166666666667,"triglycerides":110.0},"input_schema":"semiocore.biomed.labs_panel.v1","provenance":{"created_utc":"1970-01-01T00:00:00+00:00","input_hash":"35c0bb2092ecac3cbce176ca1a72d9a0926018d3b3265f7c56ce752990974a2b","tool_version":"1.3.3"},"qc":{"missing":[],"notes":[],"ok":true,"outliers":[]},"recipe":"metabolic_score_v1","schema":"semiocore.biomed.score.v1","score":0.122476190476}
